"No.","Time","Source","Destination","Protocol","Length","Info"
"1","0.000000000","::1","::1","TCP","76","57886  >  80 [SYN] Seq=0 Win=65535 Len=0 MSS=65475 WS=256 SACK_PERM"
"2","0.000049300","::1","::1","TCP","76","80  >  57886 [SYN, ACK] Seq=0 Ack=1 Win=65535 Len=0 MSS=65475 WS=256 SACK_PERM"
"3","0.000082700","::1","::1","TCP","64","57886  >  80 [ACK] Seq=1 Ack=1 Win=2618880 Len=0"
"4","0.000236400","::1","::1","TCP","76","57887  >  80 [SYN] Seq=0 Win=65535 Len=0 MSS=65475 WS=256 SACK_PERM"
"5","0.000271600","::1","::1","TCP","76","80  >  57887 [SYN, ACK] Seq=0 Ack=1 Win=65535 Len=0 MSS=65475 WS=256 SACK_PERM"
"6","0.000298100","::1","::1","TCP","64","57887  >  80 [ACK] Seq=1 Ack=1 Win=2618880 Len=0"
"7","0.000609300","::1","::1","HTTP","799","GET /interface/login/login.php?site=default HTTP/1.1 "
"8","0.000633600","::1","::1","TCP","64","80  >  57886 [ACK] Seq=1 Ack=736 Win=2618880 Len=0"
"9","0.102468600","::1","::1","TCP","4152","80  >  57886 [PSH, ACK] Seq=1 Ack=736 Win=2618880 Len=4088 [TCP PDU reassembled in 11]"
"10","0.102506500","::1","::1","TCP","64","57886  >  80 [ACK] Seq=736 Ack=4089 Win=2614784 Len=0"
"11","0.102540700","::1","::1","HTTP","3134","HTTP/1.1 200 OK  (text/html)"
"12","0.102552000","::1","::1","TCP","64","57886  >  80 [ACK] Seq=736 Ack=7159 Win=2611712 Len=0"
"13","0.231646600","::1","::1","HTTP","828","GET /interface/product_registration/product_registration_controller.php HTTP/1.1 "
"14","0.231701600","::1","::1","TCP","64","80  >  57886 [ACK] Seq=7159 Ack=1500 Win=2618112 Len=0"
"15","0.289877100","::1","::1","HTTP/JSON","625","HTTP/1.1 200 OK , JSON (application/json)"
"16","0.289907800","::1","::1","TCP","64","57886  >  80 [ACK] Seq=1500 Ack=7720 Win=2611200 Len=0"
"17","5.294973000","::1","::1","TCP","64","80  >  57886 [FIN, ACK] Seq=7720 Ack=1500 Win=2618112 Len=0"
"18","5.294999300","::1","::1","TCP","64","57886  >  80 [ACK] Seq=1500 Ack=7721 Win=2611200 Len=0"
"19","20.766283100","::1","::1","TCP","64","57886  >  80 [FIN, ACK] Seq=1500 Ack=7721 Win=2611200 Len=0"
"20","20.766309700","::1","::1","TCP","64","80  >  57886 [ACK] Seq=7721 Ack=1501 Win=2618112 Len=0"
"21","20.766487400","::1","::1","TCP","76","57925  >  80 [SYN] Seq=0 Win=65535 Len=0 MSS=65475 WS=256 SACK_PERM"
"22","20.766518400","::1","::1","TCP","76","80  >  57925 [SYN, ACK] Seq=0 Ack=1 Win=65535 Len=0 MSS=65475 WS=256 SACK_PERM"
"23","20.766538500","::1","::1","TCP","64","57925  >  80 [ACK] Seq=1 Ack=1 Win=2618880 Len=0"
"24","20.766758100","::1","::1","HTTP","1070","POST /interface/main/main_screen.php?auth=login&site=default HTTP/1.1  (application/x-www-form-urlencoded)"
"25","20.766780200","::1","::1","TCP","64","80  >  57887 [ACK] Seq=1 Ack=1007 Win=2618880 Len=0"
"26","20.906862900","::1","::1","HTTP","865","HTTP/1.1 302 Found "
"27","20.906885700","::1","::1","TCP","64","57887  >  80 [ACK] Seq=1007 Ack=802 Win=2618112 Len=0"
"28","20.909706500","::1","::1","HTTP","982","GET /interface/main/tabs/main.php?token_main=Wb1Aeol5QtnC709dpYym6KGqeCNCj4gY9cg71WOq HTTP/1.1 "
"29","20.909744500","::1","::1","TCP","64","80  >  57887 [ACK] Seq=802 Ack=1925 Win=2617856 Len=0"
"30","20.950232400","::1","::1","TCP","4152","80  >  57887 [PSH, ACK] Seq=802 Ack=1925 Win=2617856 Len=4088 [TCP PDU reassembled in 50]"
"31","20.950259800","::1","::1","TCP","64","57887  >  80 [ACK] Seq=1925 Ack=4890 Win=2614016 Len=0"
"32","20.950287500","::1","::1","TCP","7396","80  >  57887 [PSH, ACK] Seq=4890 Ack=1925 Win=2617856 Len=7332 [TCP PDU reassembled in 50]"
"33","20.950297400","::1","::1","TCP","64","57887  >  80 [ACK] Seq=1925 Ack=12222 Win=2606592 Len=0"
"34","20.980697900","::1","::1","TCP","4152","80  >  57887 [PSH, ACK] Seq=12222 Ack=1925 Win=2617856 Len=4088 [TCP PDU reassembled in 50]"
"35","20.980739800","::1","::1","TCP","64","57887  >  80 [ACK] Seq=1925 Ack=16310 Win=2602496 Len=0"
"36","20.980902300","::1","::1","TCP","5424","80  >  57887 [PSH, ACK] Seq=16310 Ack=1925 Win=2617856 Len=5360 [TCP PDU reassembled in 50]"
"37","20.980924200","::1","::1","TCP","64","57887  >  80 [ACK] Seq=1925 Ack=21670 Win=2597120 Len=0"
"38","21.016025100","::1","::1","TCP","4152","80  >  57887 [PSH, ACK] Seq=21670 Ack=1925 Win=2617856 Len=4088 [TCP PDU reassembled in 50]"
"39","21.016060800","::1","::1","TCP","64","57887  >  80 [ACK] Seq=1925 Ack=25758 Win=2593024 Len=0"
"40","21.016194100","::1","::1","TCP","4530","80  >  57887 [PSH, ACK] Seq=25758 Ack=1925 Win=2617856 Len=4466 [TCP PDU reassembled in 50]"
"41","21.016215800","::1","::1","TCP","64","57887  >  80 [ACK] Seq=1925 Ack=30224 Win=2588672 Len=0"
"42","21.062722700","::1","::1","HTTP","827","GET /library/ajax/i18n_generator.php?lang_id=1&csrf_token_form=3799c4836d3218a44a85e2cf5fdf791f67060cf2 HTTP/1.1 "
"43","21.062776800","::1","::1","TCP","64","80  >  57925 [ACK] Seq=1 Ack=764 Win=2618880 Len=0"
"44","21.736216500","::1","::1","TCP","4152","80  >  57887 [PSH, ACK] Seq=30224 Ack=1925 Win=2617856 Len=4088 [TCP PDU reassembled in 50]"
"45","21.736243000","::1","::1","TCP","64","57887  >  80 [ACK] Seq=1925 Ack=34312 Win=2584576 Len=0"
"46","21.736287600","::1","::1","TCP","13104","80  >  57887 [PSH, ACK] Seq=34312 Ack=1925 Win=2617856 Len=13040 [TCP PDU reassembled in 50]"
"47","21.736308100","::1","::1","TCP","64","57887  >  80 [ACK] Seq=1925 Ack=47352 Win=2571520 Len=0"
"48","21.750940900","::1","::1","TCP","4152","80  >  57887 [PSH, ACK] Seq=47352 Ack=1925 Win=2617856 Len=4088 [TCP PDU reassembled in 50]"
"49","21.750976100","::1","::1","TCP","64","57887  >  80 [ACK] Seq=1925 Ack=51440 Win=2567424 Len=0"
"50","21.751018700","::1","::1","HTTP","649","HTTP/1.1 200 OK  (text/html)"
"51","21.751032800","::1","::1","TCP","64","57887  >  80 [ACK] Seq=1925 Ack=52025 Win=2566912 Len=0"
"52","21.819211400","::1","::1","HTTP","924","GET /interface/main/main_info.php HTTP/1.1 "
"53","21.819247500","::1","::1","TCP","64","80  >  57887 [ACK] Seq=52025 Ack=2785 Win=2617088 Len=0"
"54","21.823723000","::1","::1","TCP","76","57932  >  80 [SYN] Seq=0 Win=65535 Len=0 MSS=65475 WS=256 SACK_PERM"
"55","21.823791300","::1","::1","TCP","76","80  >  57932 [SYN, ACK] Seq=0 Ack=1 Win=65535 Len=0 MSS=65475 WS=256 SACK_PERM"
"56","21.823825400","::1","::1","TCP","64","57932  >  80 [ACK] Seq=1 Ack=1 Win=2618880 Len=0"
"57","21.824100300","::1","::1","HTTP","946","GET /interface/main/messages/messages.php?form_active=1 HTTP/1.1 "
"58","21.824119000","::1","::1","TCP","64","80  >  57932 [ACK] Seq=1 Ack=883 Win=2618880 Len=0"
"59","21.880001000","::1","::1","HTTP","542","HTTP/1.1 302 Found "
"60","21.880031800","::1","::1","TCP","64","57887  >  80 [ACK] Seq=2785 Ack=52503 Win=2566400 Len=0"
"61","21.883581100","::1","::1","HTTP","972","GET /interface/main/calendar/index.php?module=PostCalendar&func=view&viewtype=day HTTP/1.1 "
"62","21.883629200","::1","::1","TCP","64","80  >  57887 [ACK] Seq=52503 Ack=3693 Win=2616064 Len=0"
"63","21.893293200","::1","::1","TCP","76","57933  >  80 [SYN] Seq=0 Win=65535 Len=0 MSS=65475 WS=256 SACK_PERM"
"64","21.893362800","::1","::1","TCP","76","80  >  57933 [SYN, ACK] Seq=0 Ack=1 Win=65535 Len=0 MSS=65475 WS=256 SACK_PERM"
"65","21.893418000","::1","::1","TCP","64","57933  >  80 [ACK] Seq=1 Ack=1 Win=2618880 Len=0"
"66","21.893823400","::1","::1","TCP","901","57933  >  80 [PSH, ACK] Seq=1 Ack=1 Win=2618880 Len=837 [TCP PDU reassembled in 68]"
"67","21.893847900","::1","::1","TCP","64","80  >  57933 [ACK] Seq=1 Ack=838 Win=2618880 Len=0"
"68","21.893872500","::1","::1","HTTP","738","POST /library/ajax/dated_reminders_counter.php HTTP/1.1 "
"69","21.893880900","::1","::1","TCP","64","80  >  57933 [ACK] Seq=1 Ack=1512 Win=2618112 Len=0"
"70","21.930383800","::1","::1","TCP","4152","80  >  57932 [PSH, ACK] Seq=1 Ack=883 Win=2618880 Len=4088 [TCP PDU reassembled in 92]"
"71","21.930419700","::1","::1","TCP","64","57932  >  80 [ACK] Seq=883 Ack=4089 Win=2614784 Len=0"
"72","21.930466000","::1","::1","TCP","5140","80  >  57932 [PSH, ACK] Seq=4089 Ack=883 Win=2618880 Len=5076 [TCP PDU reassembled in 92]"
"73","21.930486700","::1","::1","TCP","64","57932  >  80 [ACK] Seq=883 Ack=9165 Win=2609664 Len=0"
"74","21.978223800","::1","::1","HTTP","638","HTTP/1.1 200 OK  (text/html)"
"75","21.978286900","::1","::1","TCP","64","57933  >  80 [ACK] Seq=1512 Ack=575 Win=2618368 Len=0"
"76","21.993121500","::1","::1","TCP","4152","80  >  57932 [PSH, ACK] Seq=9165 Ack=883 Win=2618880 Len=4088 [TCP PDU reassembled in 92]"
"77","21.993155800","::1","::1","TCP","64","57932  >  80 [ACK] Seq=883 Ack=13253 Win=2605568 Len=0"
"78","21.993204700","::1","::1","TCP","5030","80  >  57932 [PSH, ACK] Seq=13253 Ack=883 Win=2618880 Len=4966 [TCP PDU reassembled in 92]"
"79","21.993225400","::1","::1","TCP","64","57932  >  80 [ACK] Seq=883 Ack=18219 Win=2600704 Len=0"
"80","22.101491400","::1","::1","TCP","4152","80  >  57932 [PSH, ACK] Seq=18219 Ack=883 Win=2618880 Len=4088 [TCP PDU reassembled in 92]"
"81","22.101540200","::1","::1","TCP","64","57932  >  80 [ACK] Seq=883 Ack=22307 Win=2596608 Len=0"
"82","22.101594900","::1","::1","TCP","5573","80  >  57932 [PSH, ACK] Seq=22307 Ack=883 Win=2618880 Len=5509 [TCP PDU reassembled in 92]"
"83","22.101615900","::1","::1","TCP","64","57932  >  80 [ACK] Seq=883 Ack=27816 Win=2590976 Len=0"
"84","22.137347500","::1","::1","TCP","4152","80  >  57932 [PSH, ACK] Seq=27816 Ack=883 Win=2618880 Len=4088 [TCP PDU reassembled in 92]"
"85","22.137389100","::1","::1","TCP","64","57932  >  80 [ACK] Seq=883 Ack=31904 Win=2586880 Len=0"
"86","22.137445500","::1","::1","TCP","4259","80  >  57932 [PSH, ACK] Seq=31904 Ack=883 Win=2618880 Len=4195 [TCP PDU reassembled in 92]"
"87","22.137467800","::1","::1","TCP","64","57932  >  80 [ACK] Seq=883 Ack=36099 Win=2582784 Len=0"
"88","22.172548900","::1","::1","TCP","4152","80  >  57932 [PSH, ACK] Seq=36099 Ack=883 Win=2618880 Len=4088 [TCP PDU reassembled in 92]"
"89","22.172584800","::1","::1","TCP","64","57932  >  80 [ACK] Seq=883 Ack=40187 Win=2578688 Len=0"
"90","22.172637900","::1","::1","TCP","6238","80  >  57932 [PSH, ACK] Seq=40187 Ack=883 Win=2618880 Len=6174 [TCP PDU reassembled in 92]"
"91","22.172660100","::1","::1","TCP","64","57932  >  80 [ACK] Seq=883 Ack=46361 Win=2572544 Len=0"
"92","22.172703300","::1","::1","HTTP","2637","HTTP/1.1 200 OK  (text/html)"
"93","22.172717500","::1","::1","TCP","64","57932  >  80 [ACK] Seq=883 Ack=48934 Win=2569984 Len=0"
"94","22.511592000","::1","::1","HTTP","914","GET /Documentation/help_files/message_center_help.php HTTP/1.1 "
"95","22.511636200","::1","::1","TCP","64","80  >  57932 [ACK] Seq=48934 Ack=1733 Win=2618112 Len=0"
"96","22.535956400","::1","::1","HTTP","977","POST /interface/main/dated_reminders/dated_reminders.php HTTP/1.1  (application/x-www-form-urlencoded)"
"97","22.536010100","::1","::1","TCP","64","80  >  57933 [ACK] Seq=575 Ack=2425 Win=2617344 Len=0"
"98","22.672450300","::1","::1","HTTP","545","HTTP/1.1 200 OK  (text/html)"
"99","22.672488600","::1","::1","TCP","64","57933  >  80 [ACK] Seq=2425 Ack=1056 Win=2617856 Len=0"
"100","22.686941500","::1","::1","TCP","4152","80  >  57932 [PSH, ACK] Seq=48934 Ack=1733 Win=2618112 Len=4088 [TCP PDU reassembled in 112]"
"101","22.686995700","::1","::1","TCP","64","57932  >  80 [ACK] Seq=1733 Ack=53022 Win=2565888 Len=0"
"102","22.687060500","::1","::1","TCP","4691","80  >  57932 [PSH, ACK] Seq=53022 Ack=1733 Win=2618112 Len=4627 [TCP PDU reassembled in 112]"
"103","22.687076900","::1","::1","TCP","64","57932  >  80 [ACK] Seq=1733 Ack=57649 Win=2561280 Len=0"
"104","22.720683400","::1","::1","HTTP","469","HTTP/1.1 200 OK  (text/html)"
"105","22.720723400","::1","::1","TCP","64","57925  >  80 [ACK] Seq=764 Ack=406 Win=2618368 Len=0"
"106","22.762238700","::1","::1","TCP","4152","80  >  57932 [PSH, ACK] Seq=57649 Ack=1733 Win=2618112 Len=4088 [TCP PDU reassembled in 112]"
"107","22.762280000","::1","::1","TCP","64","57932  >  80 [ACK] Seq=1733 Ack=61737 Win=2557184 Len=0"
"108","22.762334500","::1","::1","TCP","4301","80  >  57932 [PSH, ACK] Seq=61737 Ack=1733 Win=2618112 Len=4237 [TCP PDU reassembled in 112]"
"109","22.762367000","::1","::1","TCP","64","57932  >  80 [ACK] Seq=1733 Ack=65974 Win=2618880 Len=0"
"110","22.792141900","::1","::1","TCP","4152","80  >  57932 [PSH, ACK] Seq=65974 Ack=1733 Win=2618112 Len=4088 [TCP PDU reassembled in 112]"
"111","22.792174200","::1","::1","TCP","64","57932  >  80 [ACK] Seq=1733 Ack=70062 Win=2614784 Len=0"
"112","22.792219400","::1","::1","HTTP","1206","HTTP/1.1 200 OK  (text/html)"
"113","22.792237500","::1","::1","TCP","64","57932  >  80 [ACK] Seq=1733 Ack=71204 Win=2613760 Len=0"
"114","22.832487600","::1","::1","TCP","4152","80  >  57887 [PSH, ACK] Seq=52503 Ack=3693 Win=2616064 Len=4088 [TCP PDU reassembled in 118]"
"115","22.832519900","::1","::1","TCP","64","57887  >  80 [ACK] Seq=3693 Ack=56591 Win=2562304 Len=0"
"116","22.832571200","::1","::1","TCP","21372","80  >  57887 [PSH, ACK] Seq=56591 Ack=3693 Win=2616064 Len=21308 [TCP PDU reassembled in 118]"
"117","22.832601800","::1","::1","TCP","64","57887  >  80 [ACK] Seq=3693 Ack=77899 Win=2618880 Len=0"
"118","22.832638500","::1","::1","HTTP","69","HTTP/1.1 200 OK  (text/html)"
"119","22.832646200","::1","::1","TCP","64","57887  >  80 [ACK] Seq=3693 Ack=77904 Win=2618880 Len=0"
"120","27.677191800","::1","::1","TCP","64","80  >  57933 [FIN, ACK] Seq=1056 Ack=2425 Win=2617344 Len=0"
"121","27.677219700","::1","::1","TCP","64","57933  >  80 [ACK] Seq=2425 Ack=1057 Win=2617856 Len=0"
"122","27.725330800","::1","::1","TCP","64","80  >  57925 [FIN, ACK] Seq=406 Ack=764 Win=2618880 Len=0"
"123","27.725361100","::1","::1","TCP","64","57925  >  80 [ACK] Seq=764 Ack=407 Win=2618368 Len=0"
"124","27.796562200","::1","::1","TCP","64","80  >  57932 [FIN, ACK] Seq=71204 Ack=1733 Win=2618112 Len=0"
"125","27.796583200","::1","::1","TCP","64","57932  >  80 [ACK] Seq=1733 Ack=71205 Win=2613760 Len=0"
"126","27.837693900","::1","::1","TCP","64","80  >  57887 [FIN, ACK] Seq=77904 Ack=3693 Win=2616064 Len=0"
"127","27.837726200","::1","::1","TCP","64","57887  >  80 [ACK] Seq=3693 Ack=77905 Win=2618880 Len=0"
"128","28.747476900","::1","::1","TCP","64","57933  >  80 [FIN, ACK] Seq=2425 Ack=1057 Win=2617856 Len=0"
"129","28.747496200","::1","::1","TCP","64","80  >  57933 [ACK] Seq=1057 Ack=2426 Win=2617344 Len=0"
"130","28.747572800","::1","::1","TCP","64","57925  >  80 [FIN, ACK] Seq=764 Ack=407 Win=2618368 Len=0"
"131","28.747580900","::1","::1","TCP","64","80  >  57925 [ACK] Seq=407 Ack=765 Win=2618880 Len=0"
"132","28.747627000","::1","::1","TCP","64","57932  >  80 [FIN, ACK] Seq=1733 Ack=71205 Win=2613760 Len=0"
"133","28.747634500","::1","::1","TCP","64","80  >  57932 [ACK] Seq=71205 Ack=1734 Win=2618112 Len=0"
"134","28.747680000","::1","::1","TCP","64","57887  >  80 [FIN, ACK] Seq=3693 Ack=77905 Win=2618880 Len=0"
"135","28.747699300","::1","::1","TCP","64","80  >  57887 [ACK] Seq=77905 Ack=3694 Win=2616064 Len=0"
"136","28.748013500","::1","::1","TCP","76","57954  >  80 [SYN] Seq=0 Win=65535 Len=0 MSS=65475 WS=256 SACK_PERM"
"137","28.748061500","::1","::1","TCP","76","80  >  57954 [SYN, ACK] Seq=0 Ack=1 Win=65535 Len=0 MSS=65475 WS=256 SACK_PERM"
"138","28.748087900","::1","::1","TCP","64","57954  >  80 [ACK] Seq=1 Ack=1 Win=2618880 Len=0"
"139","28.748349800","::1","::1","HTTP","937","GET /interface/new/new.php HTTP/1.1 "
"140","28.748373100","::1","::1","TCP","64","80  >  57954 [ACK] Seq=1 Ack=874 Win=2618880 Len=0"
"141","28.835879000","::1","::1","TCP","4152","80  >  57954 [PSH, ACK] Seq=1 Ack=874 Win=2618880 Len=4088 [TCP PDU reassembled in 235]"
"142","28.835904600","::1","::1","TCP","64","57954  >  80 [ACK] Seq=874 Ack=4089 Win=2614784 Len=0"
"143","28.835941900","::1","::1","TCP","6988","80  >  57954 [PSH, ACK] Seq=4089 Ack=874 Win=2618880 Len=6924 [TCP PDU reassembled in 235]"
"144","28.835955400","::1","::1","TCP","64","57954  >  80 [ACK] Seq=874 Ack=11013 Win=2607872 Len=0"
"145","28.851468100","::1","::1","TCP","4152","80  >  57954 [PSH, ACK] Seq=11013 Ack=874 Win=2618880 Len=4088 [TCP PDU reassembled in 235]"
"146","28.851496800","::1","::1","TCP","64","57954  >  80 [ACK] Seq=874 Ack=15101 Win=2603776 Len=0"
"147","28.851533400","::1","::1","TCP","5595","80  >  57954 [PSH, ACK] Seq=15101 Ack=874 Win=2618880 Len=5531 [TCP PDU reassembled in 235]"
"148","28.851548500","::1","::1","TCP","64","57954  >  80 [ACK] Seq=874 Ack=20632 Win=2598144 Len=0"
"149","28.868739800","::1","::1","TCP","4152","80  >  57954 [PSH, ACK] Seq=20632 Ack=874 Win=2618880 Len=4088 [TCP PDU reassembled in 235]"
"150","28.868773000","::1","::1","TCP","64","57954  >  80 [ACK] Seq=874 Ack=24720 Win=2594048 Len=0"
"151","28.868808600","::1","::1","TCP","4329","80  >  57954 [PSH, ACK] Seq=24720 Ack=874 Win=2618880 Len=4265 [TCP PDU reassembled in 235]"
"152","28.868819900","::1","::1","TCP","64","57954  >  80 [ACK] Seq=874 Ack=28985 Win=2589952 Len=0"
"153","28.868839200","::1","::1","TCP","8353","80  >  57954 [PSH, ACK] Seq=28985 Ack=874 Win=2618880 Len=8289 [TCP PDU reassembled in 235]"
"154","28.868853500","::1","::1","TCP","64","57954  >  80 [ACK] Seq=874 Ack=37274 Win=2581504 Len=0"
"155","28.879271000","::1","::1","TCP","4152","80  >  57954 [PSH, ACK] Seq=37274 Ack=874 Win=2618880 Len=4088 [TCP PDU reassembled in 235]"
"156","28.879303600","::1","::1","TCP","64","57954  >  80 [ACK] Seq=874 Ack=41362 Win=2577408 Len=0"
"157","28.879343400","::1","::1","TCP","4397","80  >  57954 [PSH, ACK] Seq=41362 Ack=874 Win=2618880 Len=4333 [TCP PDU reassembled in 235]"
"158","28.879363900","::1","::1","TCP","64","57954  >  80 [ACK] Seq=874 Ack=45695 Win=2573056 Len=0"
"159","28.901597700","::1","::1","TCP","4152","80  >  57954 [PSH, ACK] Seq=45695 Ack=874 Win=2618880 Len=4088 [TCP PDU reassembled in 235]"
"160","28.901624000","::1","::1","TCP","64","57954  >  80 [ACK] Seq=874 Ack=49783 Win=2569216 Len=0"
"161","28.901655200","::1","::1","TCP","4447","80  >  57954 [PSH, ACK] Seq=49783 Ack=874 Win=2618880 Len=4383 [TCP PDU reassembled in 235]"
"162","28.901672200","::1","::1","TCP","64","57954  >  80 [ACK] Seq=874 Ack=54166 Win=2564608 Len=0"
"163","28.944158100","::1","::1","TCP","4152","80  >  57954 [PSH, ACK] Seq=54166 Ack=874 Win=2618880 Len=4088 [TCP PDU reassembled in 235]"
"164","28.944210900","::1","::1","TCP","64","57954  >  80 [ACK] Seq=874 Ack=58254 Win=2560512 Len=0"
"165","28.944340800","::1","::1","TCP","5108","80  >  57954 [PSH, ACK] Seq=58254 Ack=874 Win=2618880 Len=5044 [TCP PDU reassembled in 235]"
"166","28.944368900","::1","::1","TCP","64","57954  >  80 [ACK] Seq=874 Ack=63298 Win=2555648 Len=0"
"167","28.975782000","::1","::1","TCP","4152","80  >  57954 [PSH, ACK] Seq=63298 Ack=874 Win=2618880 Len=4088 [TCP PDU reassembled in 235]"
"168","28.975809900","::1","::1","TCP","64","57954  >  80 [ACK] Seq=874 Ack=67386 Win=2618880 Len=0"
"169","28.975846200","::1","::1","TCP","4455","80  >  57954 [PSH, ACK] Seq=67386 Ack=874 Win=2618880 Len=4391 [TCP PDU reassembled in 235]"
"170","28.975866700","::1","::1","TCP","64","57954  >  80 [ACK] Seq=874 Ack=71777 Win=2614528 Len=0"
"171","29.004617500","::1","::1","TCP","4152","80  >  57954 [PSH, ACK] Seq=71777 Ack=874 Win=2618880 Len=4088 [TCP PDU reassembled in 235]"
"172","29.004644500","::1","::1","TCP","64","57954  >  80 [ACK] Seq=874 Ack=75865 Win=2610432 Len=0"
"173","29.004674500","::1","::1","TCP","14961","80  >  57954 [PSH, ACK] Seq=75865 Ack=874 Win=2618880 Len=14897 [TCP PDU reassembled in 235]"
"174","29.004692100","::1","::1","TCP","64","57954  >  80 [ACK] Seq=874 Ack=90762 Win=2595584 Len=0"
"175","29.052156300","::1","::1","TCP","4152","80  >  57954 [PSH, ACK] Seq=90762 Ack=874 Win=2618880 Len=4088 [TCP PDU reassembled in 235]"
"176","29.052192600","::1","::1","TCP","64","57954  >  80 [ACK] Seq=874 Ack=94850 Win=2591488 Len=0"
"177","29.052228900","::1","::1","TCP","4740","80  >  57954 [PSH, ACK] Seq=94850 Ack=874 Win=2618880 Len=4676 [TCP PDU reassembled in 235]"
"178","29.052255600","::1","::1","TCP","64","57954  >  80 [ACK] Seq=874 Ack=99526 Win=2586624 Len=0"
"179","29.106473300","::1","::1","TCP","4152","80  >  57954 [PSH, ACK] Seq=99526 Ack=874 Win=2618880 Len=4088 [TCP PDU reassembled in 235]"
"180","29.106497900","::1","::1","TCP","64","57954  >  80 [ACK] Seq=874 Ack=103614 Win=2582528 Len=0"
"181","29.106531700","::1","::1","TCP","4493","80  >  57954 [PSH, ACK] Seq=103614 Ack=874 Win=2618880 Len=4429 [TCP PDU reassembled in 235]"
"182","29.106551500","::1","::1","TCP","64","57954  >  80 [ACK] Seq=874 Ack=108043 Win=2578176 Len=0"
"183","29.148538000","::1","::1","TCP","4152","80  >  57954 [PSH, ACK] Seq=108043 Ack=874 Win=2618880 Len=4088 [TCP PDU reassembled in 235]"
"184","29.148574900","::1","::1","TCP","64","57954  >  80 [ACK] Seq=874 Ack=112131 Win=2574080 Len=0"
"185","29.148627600","::1","::1","TCP","9578","80  >  57954 [PSH, ACK] Seq=112131 Ack=874 Win=2618880 Len=9514 [TCP PDU reassembled in 235]"
"186","29.148641000","::1","::1","TCP","64","57954  >  80 [ACK] Seq=874 Ack=121645 Win=2564608 Len=0"
"187","29.171947400","::1","::1","TCP","4152","80  >  57954 [PSH, ACK] Seq=121645 Ack=874 Win=2618880 Len=4088 [TCP PDU reassembled in 235]"
"188","29.171976700","::1","::1","TCP","64","57954  >  80 [ACK] Seq=874 Ack=125733 Win=2560512 Len=0"
"189","29.172007100","::1","::1","TCP","7842","80  >  57954 [PSH, ACK] Seq=125733 Ack=874 Win=2618880 Len=7778 [TCP PDU reassembled in 235]"
"190","29.172020800","::1","::1","TCP","64","57954  >  80 [ACK] Seq=874 Ack=133511 Win=2618880 Len=0"
"191","29.197425000","::1","::1","TCP","4152","80  >  57954 [PSH, ACK] Seq=133511 Ack=874 Win=2618880 Len=4088 [TCP PDU reassembled in 235]"
"192","29.197449500","::1","::1","TCP","64","57954  >  80 [ACK] Seq=874 Ack=137599 Win=2614784 Len=0"
"193","29.197488500","::1","::1","TCP","5029","80  >  57954 [PSH, ACK] Seq=137599 Ack=874 Win=2618880 Len=4965 [TCP PDU reassembled in 235]"
"194","29.197509500","::1","::1","TCP","64","57954  >  80 [ACK] Seq=874 Ack=142564 Win=2609920 Len=0"
"195","29.221520900","::1","::1","TCP","4152","80  >  57954 [PSH, ACK] Seq=142564 Ack=874 Win=2618880 Len=4088 [TCP PDU reassembled in 235]"
"196","29.221548100","::1","::1","TCP","64","57954  >  80 [ACK] Seq=874 Ack=146652 Win=2605824 Len=0"
"197","29.221583100","::1","::1","TCP","4378","80  >  57954 [PSH, ACK] Seq=146652 Ack=874 Win=2618880 Len=4314 [TCP PDU reassembled in 235]"
"198","29.221600700","::1","::1","TCP","64","57954  >  80 [ACK] Seq=874 Ack=150966 Win=2601472 Len=0"
"199","29.271928000","::1","::1","TCP","4152","80  >  57954 [PSH, ACK] Seq=150966 Ack=874 Win=2618880 Len=4088 [TCP PDU reassembled in 235]"
"200","29.271960100","::1","::1","TCP","64","57954  >  80 [ACK] Seq=874 Ack=155054 Win=2597376 Len=0"
"201","29.272002500","::1","::1","TCP","4321","80  >  57954 [PSH, ACK] Seq=155054 Ack=874 Win=2618880 Len=4257 [TCP PDU reassembled in 235]"
"202","29.272014000","::1","::1","TCP","64","57954  >  80 [ACK] Seq=874 Ack=159311 Win=2593024 Len=0"
"203","29.297697100","::1","::1","TCP","4152","80  >  57954 [PSH, ACK] Seq=159311 Ack=874 Win=2618880 Len=4088 [TCP PDU reassembled in 235]"
"204","29.297745500","::1","::1","TCP","64","57954  >  80 [ACK] Seq=874 Ack=163399 Win=2588928 Len=0"
"205","29.297779500","::1","::1","TCP","4246","80  >  57954 [PSH, ACK] Seq=163399 Ack=874 Win=2618880 Len=4182 [TCP PDU reassembled in 235]"
"206","29.297793900","::1","::1","TCP","64","57954  >  80 [ACK] Seq=874 Ack=167581 Win=2584832 Len=0"
"207","29.313957800","::1","::1","TCP","4152","80  >  57954 [PSH, ACK] Seq=167581 Ack=874 Win=2618880 Len=4088 [TCP PDU reassembled in 235]"
"208","29.313981400","::1","::1","TCP","64","57954  >  80 [ACK] Seq=874 Ack=171669 Win=2580736 Len=0"
"209","29.314009300","::1","::1","TCP","4222","80  >  57954 [PSH, ACK] Seq=171669 Ack=874 Win=2618880 Len=4158 [TCP PDU reassembled in 235]"
"210","29.314019500","::1","::1","TCP","64","57954  >  80 [ACK] Seq=874 Ack=175827 Win=2576640 Len=0"
"211","29.339106400","::1","::1","TCP","4152","80  >  57954 [PSH, ACK] Seq=175827 Ack=874 Win=2618880 Len=4088 [TCP PDU reassembled in 235]"
"212","29.339141100","::1","::1","TCP","64","57954  >  80 [ACK] Seq=874 Ack=179915 Win=2572544 Len=0"
"213","29.339182900","::1","::1","TCP","4916","80  >  57954 [PSH, ACK] Seq=179915 Ack=874 Win=2618880 Len=4852 [TCP PDU reassembled in 235]"
"214","29.339197600","::1","::1","TCP","64","57954  >  80 [ACK] Seq=874 Ack=184767 Win=2567680 Len=0"
"215","29.358331500","::1","::1","TCP","4152","80  >  57954 [PSH, ACK] Seq=184767 Ack=874 Win=2618880 Len=4088 [TCP PDU reassembled in 235]"
"216","29.358363300","::1","::1","TCP","64","57954  >  80 [ACK] Seq=874 Ack=188855 Win=2563584 Len=0"
"217","29.358402900","::1","::1","TCP","4261","80  >  57954 [PSH, ACK] Seq=188855 Ack=874 Win=2618880 Len=4197 [TCP PDU reassembled in 235]"
"218","29.358419400","::1","::1","TCP","64","57954  >  80 [ACK] Seq=874 Ack=193052 Win=2559232 Len=0"
"219","29.393294400","::1","::1","TCP","4152","80  >  57954 [PSH, ACK] Seq=193052 Ack=874 Win=2618880 Len=4088 [TCP PDU reassembled in 235]"
"220","29.393329000","::1","::1","TCP","64","57954  >  80 [ACK] Seq=874 Ack=197140 Win=2555136 Len=0"
"221","29.393365400","::1","::1","TCP","6543","80  >  57954 [PSH, ACK] Seq=197140 Ack=874 Win=2618880 Len=6479 [TCP PDU reassembled in 235]"
"222","29.393380700","::1","::1","TCP","64","57954  >  80 [ACK] Seq=874 Ack=203619 Win=2618880 Len=0"
"223","29.398661200","::1","::1","TCP","4152","80  >  57954 [PSH, ACK] Seq=203619 Ack=874 Win=2618880 Len=4088 [TCP PDU reassembled in 235]"
"224","29.398687400","::1","::1","TCP","64","57954  >  80 [ACK] Seq=874 Ack=207707 Win=2614784 Len=0"
"225","29.398719500","::1","::1","TCP","4265","80  >  57954 [PSH, ACK] Seq=207707 Ack=874 Win=2618880 Len=4201 [TCP PDU reassembled in 235]"
"226","29.398734100","::1","::1","TCP","64","57954  >  80 [ACK] Seq=874 Ack=211908 Win=2610688 Len=0"
"227","29.434613400","::1","::1","TCP","4152","80  >  57954 [PSH, ACK] Seq=211908 Ack=874 Win=2618880 Len=4088 [TCP PDU reassembled in 235]"
"228","29.434651600","::1","::1","TCP","64","57954  >  80 [ACK] Seq=874 Ack=215996 Win=2606592 Len=0"
"229","29.434692400","::1","::1","TCP","4194","80  >  57954 [PSH, ACK] Seq=215996 Ack=874 Win=2618880 Len=4130 [TCP PDU reassembled in 235]"
"230","29.434709100","::1","::1","TCP","64","57954  >  80 [ACK] Seq=874 Ack=220126 Win=2602240 Len=0"
"231","29.496132600","::1","::1","TCP","4152","80  >  57954 [PSH, ACK] Seq=220126 Ack=874 Win=2618880 Len=4088 [TCP PDU reassembled in 235]"
"232","29.496159800","::1","::1","TCP","64","57954  >  80 [ACK] Seq=874 Ack=224214 Win=2598400 Len=0"
"233","29.496192700","::1","::1","TCP","8653","80  >  57954 [PSH, ACK] Seq=224214 Ack=874 Win=2618880 Len=8589 [TCP PDU reassembled in 235]"
"234","29.496203200","::1","::1","TCP","64","57954  >  80 [ACK] Seq=874 Ack=232803 Win=2589696 Len=0"
"235","29.502180400","::1","::1","HTTP","1968","HTTP/1.1 200 OK  (text/html)"
"236","29.502199900","::1","::1","TCP","64","57954  >  80 [ACK] Seq=874 Ack=234707 Win=2587904 Len=0"
"237","31.387138700","::1","::1","HTTP","1021","GET /interface/main/finder/patient_select.php?popup=1&csrf_token_form=3799c4836d3218a44a85e2cf5fdf791f67060cf2 HTTP/1.1 "
"238","31.387170300","::1","::1","TCP","64","80  >  57954 [ACK] Seq=234707 Ack=1831 Win=2617856 Len=0"
"239","31.541613200","::1","::1","TCP","4152","80  >  57954 [PSH, ACK] Seq=234707 Ack=1831 Win=2617856 Len=4088 [TCP PDU reassembled in 243]"
"240","31.541642400","::1","::1","TCP","64","57954  >  80 [ACK] Seq=1831 Ack=238795 Win=2583808 Len=0"
"241","31.541675000","::1","::1","TCP","5603","80  >  57954 [PSH, ACK] Seq=238795 Ack=1831 Win=2617856 Len=5539 [TCP PDU reassembled in 243]"
"242","31.541688300","::1","::1","TCP","64","57954  >  80 [ACK] Seq=1831 Ack=244334 Win=2578176 Len=0"
"243","31.577930900","::1","::1","HTTP","1419","HTTP/1.1 200 OK  (text/html)"
"244","31.577966800","::1","::1","TCP","64","57954  >  80 [ACK] Seq=1831 Ack=245689 Win=2576896 Len=0"
"267","31.896651100","::1","::1","HTTP","1289","POST /library/ajax/execute_background_services.php HTTP/1.1 "
"268","31.896700000","::1","::1","TCP","64","80  >  57954 [ACK] Seq=245689 Ack=3056 Win=2616576 Len=0"
"269","32.021301000","::1","::1","HTTP","466","HTTP/1.1 200 OK "
"270","32.021323000","::1","::1","TCP","64","57954  >  80 [ACK] Seq=3056 Ack=246091 Win=2576384 Len=0"
"295","34.084723800","::1","::1","HTTP","914","GET /interface/patient_file/summary/demographics.php?set_pid=1 HTTP/1.1 "
"296","34.084765200","::1","::1","TCP","64","80  >  57954 [ACK] Seq=246091 Ack=3906 Win=2615808 Len=0"
"297","34.495529300","::1","::1","TCP","4152","80  >  57954 [PSH, ACK] Seq=246091 Ack=3906 Win=2615808 Len=4088 [TCP PDU reassembled in 327]"
"298","34.495552400","::1","::1","TCP","64","57954  >  80 [ACK] Seq=3906 Ack=250179 Win=2572288 Len=0"
"299","34.495587500","::1","::1","TCP","6836","80  >  57954 [PSH, ACK] Seq=250179 Ack=3906 Win=2615808 Len=6772 [TCP PDU reassembled in 327]"
"300","34.495601200","::1","::1","TCP","64","57954  >  80 [ACK] Seq=3906 Ack=256951 Win=2565632 Len=0"
"301","34.516278600","::1","::1","TCP","4152","80  >  57954 [PSH, ACK] Seq=256951 Ack=3906 Win=2615808 Len=4088 [TCP PDU reassembled in 327]"
"302","34.516308200","::1","::1","TCP","64","57954  >  80 [ACK] Seq=3906 Ack=261039 Win=2561536 Len=0"
"303","34.516353600","::1","::1","TCP","5015","80  >  57954 [PSH, ACK] Seq=261039 Ack=3906 Win=2615808 Len=4951 [TCP PDU reassembled in 327]"
"304","34.516373300","::1","::1","TCP","64","57954  >  80 [ACK] Seq=3906 Ack=265990 Win=2556416 Len=0"
"305","34.543035100","::1","::1","TCP","4152","80  >  57954 [PSH, ACK] Seq=265990 Ack=3906 Win=2615808 Len=4088 [TCP PDU reassembled in 327]"
"306","34.543068100","::1","::1","TCP","64","57954  >  80 [ACK] Seq=3906 Ack=270078 Win=2618880 Len=0"
"307","34.543106800","::1","::1","TCP","4686","80  >  57954 [PSH, ACK] Seq=270078 Ack=3906 Win=2615808 Len=4622 [TCP PDU reassembled in 327]"
"308","34.543118200","::1","::1","TCP","64","57954  >  80 [ACK] Seq=3906 Ack=274700 Win=2614272 Len=0"
"309","34.647440300","::1","::1","TCP","4152","80  >  57954 [PSH, ACK] Seq=274700 Ack=3906 Win=2615808 Len=4088 [TCP PDU reassembled in 327]"
"310","34.647464300","::1","::1","TCP","64","57954  >  80 [ACK] Seq=3906 Ack=278788 Win=2610176 Len=0"
"311","34.647495700","::1","::1","TCP","4657","80  >  57954 [PSH, ACK] Seq=278788 Ack=3906 Win=2615808 Len=4593 [TCP PDU reassembled in 327]"
"312","34.647510100","::1","::1","TCP","64","57954  >  80 [ACK] Seq=3906 Ack=283381 Win=2605568 Len=0"
"313","34.921553600","::1","::1","TCP","4152","80  >  57954 [PSH, ACK] Seq=283381 Ack=3906 Win=2615808 Len=4088 [TCP PDU reassembled in 327]"
"314","34.921586300","::1","::1","TCP","64","57954  >  80 [ACK] Seq=3906 Ack=287469 Win=2601472 Len=0"
"315","34.921636600","::1","::1","TCP","27229","80  >  57954 [PSH, ACK] Seq=287469 Ack=3906 Win=2615808 Len=27165 [TCP PDU reassembled in 327]"
"316","34.921657700","::1","::1","TCP","64","57954  >  80 [ACK] Seq=3906 Ack=314634 Win=2574336 Len=0"
"317","35.008651500","::1","::1","TCP","4152","80  >  57954 [PSH, ACK] Seq=314634 Ack=3906 Win=2615808 Len=4088 [TCP PDU reassembled in 327]"
"318","35.008674200","::1","::1","TCP","64","57954  >  80 [ACK] Seq=3906 Ack=318722 Win=2570240 Len=0"
"319","35.008702500","::1","::1","TCP","5075","80  >  57954 [PSH, ACK] Seq=318722 Ack=3906 Win=2615808 Len=5011 [TCP PDU reassembled in 327]"
"320","35.008710500","::1","::1","TCP","64","57954  >  80 [ACK] Seq=3906 Ack=323733 Win=2565120 Len=0"
"321","35.174168800","::1","::1","TCP","4152","80  >  57954 [PSH, ACK] Seq=323733 Ack=3906 Win=2615808 Len=4088 [TCP PDU reassembled in 327]"
"322","35.174194800","::1","::1","TCP","64","57954  >  80 [ACK] Seq=3906 Ack=327821 Win=2561024 Len=0"
"323","35.174220800","::1","::1","TCP","4976","80  >  57954 [PSH, ACK] Seq=327821 Ack=3906 Win=2615808 Len=4912 [TCP PDU reassembled in 327]"
"324","35.174231100","::1","::1","TCP","64","57954  >  80 [ACK] Seq=3906 Ack=332733 Win=2556160 Len=0"
"325","35.182062500","::1","::1","TCP","4152","80  >  57954 [PSH, ACK] Seq=332733 Ack=3906 Win=2615808 Len=4088 [TCP PDU reassembled in 327]"
"326","35.182085700","::1","::1","TCP","64","57954  >  80 [ACK] Seq=3906 Ack=336821 Win=2618880 Len=0"
"327","35.182109300","::1","::1","HTTP","517","HTTP/1.1 200 OK  (text/html)"
"328","35.182115200","::1","::1","TCP","64","57954  >  80 [ACK] Seq=3906 Ack=337274 Win=2618368 Len=0"
"329","35.187046200","::1","::1","HTTP","924","GET /Documentation/help_files/medical_dashboard_help.php HTTP/1.1 "
"330","35.187093100","::1","::1","TCP","64","80  >  57954 [ACK] Seq=337274 Ack=4766 Win=2615040 Len=0"
"331","35.192494200","::1","::1","TCP","76","57955  >  80 [SYN] Seq=0 Win=65535 Len=0 MSS=65475 WS=256 SACK_PERM"
"332","35.192547100","::1","::1","TCP","76","80  >  57955 [SYN, ACK] Seq=0 Ack=1 Win=65535 Len=0 MSS=65475 WS=256 SACK_PERM"
"333","35.192576200","::1","::1","TCP","64","57955  >  80 [ACK] Seq=1 Ack=1 Win=2618880 Len=0"
"334","35.192955200","::1","::1","HTTP","1169","POST /interface/patient_file/summary/stats.php HTTP/1.1 "
"335","35.192981700","::1","::1","TCP","64","80  >  57955 [ACK] Seq=1 Ack=1106 Win=2618880 Len=0"
"336","35.195116900","::1","::1","TCP","76","57956  >  80 [SYN] Seq=0 Win=65535 Len=0 MSS=65475 WS=256 SACK_PERM"
"337","35.195258200","::1","::1","TCP","76","80  >  57956 [SYN, ACK] Seq=0 Ack=1 Win=65535 Len=0 MSS=65475 WS=256 SACK_PERM"
"338","35.195386300","::1","::1","TCP","64","57956  >  80 [ACK] Seq=1 Ack=1 Win=2618880 Len=0"
"339","35.196158700","::1","::1","TCP","76","57957  >  80 [SYN] Seq=0 Win=65535 Len=0 MSS=65475 WS=256 SACK_PERM"
"340","35.196222300","::1","::1","TCP","76","80  >  57957 [SYN, ACK] Seq=0 Ack=1 Win=65535 Len=0 MSS=65475 WS=256 SACK_PERM"
"341","35.196269000","::1","::1","TCP","64","57957  >  80 [ACK] Seq=1 Ack=1 Win=2618880 Len=0"
"342","35.196770800","::1","::1","HTTP","1074","POST /interface/patient_file/summary/pnotes_fragment.php HTTP/1.1 "
"343","35.196825800","::1","::1","TCP","64","80  >  57956 [ACK] Seq=1 Ack=1011 Win=2618880 Len=0"
"344","35.197182700","::1","::1","HTTP","1072","POST /interface/patient_file/summary/disc_fragment.php HTTP/1.1 "
"345","35.197209600","::1","::1","TCP","64","80  >  57957 [ACK] Seq=1 Ack=1009 Win=2618880 Len=0"
"346","35.198008200","::1","::1","TCP","76","57958  >  80 [SYN] Seq=0 Win=65535 Len=0 MSS=65475 WS=256 SACK_PERM"
"347","35.198061900","::1","::1","TCP","76","80  >  57958 [SYN, ACK] Seq=0 Ack=1 Win=65535 Len=0 MSS=65475 WS=256 SACK_PERM"
"348","35.198101800","::1","::1","TCP","64","57958  >  80 [ACK] Seq=1 Ack=1 Win=2618880 Len=0"
"349","35.199189100","::1","::1","HTTP","1075","POST /interface/patient_file/summary/labdata_fragment.php HTTP/1.1 "
"350","35.199216400","::1","::1","TCP","64","80  >  57958 [ACK] Seq=1 Ack=1012 Win=2618880 Len=0"
"351","35.199729100","::1","::1","TCP","76","57959  >  80 [SYN] Seq=0 Win=65535 Len=0 MSS=65475 WS=256 SACK_PERM"
"352","35.199785900","::1","::1","TCP","76","80  >  57959 [SYN, ACK] Seq=0 Ack=1 Win=65535 Len=0 MSS=65475 WS=256 SACK_PERM"
"353","35.199821000","::1","::1","TCP","64","57959  >  80 [ACK] Seq=1 Ack=1 Win=2618880 Len=0"
"354","35.200375900","::1","::1","HTTP","1074","POST /interface/patient_file/summary/vitals_fragment.php HTTP/1.1 "
"355","35.200405300","::1","::1","TCP","64","80  >  57959 [ACK] Seq=1 Ack=1011 Win=2618880 Len=0"
"356","35.257650900","::1","::1","HTTP","654","HTTP/1.1 200 OK  (text/html)"
"357","35.257674400","::1","::1","TCP","64","57958  >  80 [ACK] Seq=1012 Ack=591 Win=2618368 Len=0"
"358","35.259175000","::1","::1","HTTP","1191","POST /interface/patient_file/summary/clinical_reminders_fragment.php HTTP/1.1 "
"359","35.259219100","::1","::1","TCP","64","80  >  57958 [ACK] Seq=591 Ack=2139 Win=2617856 Len=0"
"360","35.261535400","::1","::1","HTTP","578","HTTP/1.1 200 OK  (text/html)"
"361","35.261566100","::1","::1","TCP","64","57959  >  80 [ACK] Seq=1011 Ack=515 Win=2618368 Len=0"
"362","35.262927800","::1","::1","HTTP","1085","POST /interface/patient_file/summary/patient_reminders_fragment.php HTTP/1.1 "
"363","35.262962200","::1","::1","TCP","64","80  >  57959 [ACK] Seq=515 Ack=2032 Win=2617856 Len=0"
"364","35.271139300","::1","::1","HTTP","1017","HTTP/1.1 200 OK  (text/html)"
"365","35.271166900","::1","::1","TCP","64","57957  >  80 [ACK] Seq=1009 Ack=954 Win=2617856 Len=0"
"366","35.288451600","::1","::1","TCP","4152","80  >  57954 [PSH, ACK] Seq=337274 Ack=4766 Win=2615040 Len=4088 [TCP PDU reassembled in 374]"
"367","35.288483500","::1","::1","TCP","64","57954  >  80 [ACK] Seq=4766 Ack=341362 Win=2614272 Len=0"
"368","35.288538800","::1","::1","TCP","4718","80  >  57954 [PSH, ACK] Seq=341362 Ack=4766 Win=2615040 Len=4654 [TCP PDU reassembled in 374]"
"369","35.288554100","::1","::1","TCP","64","57954  >  80 [ACK] Seq=4766 Ack=346016 Win=2609664 Len=0"
"370","35.346387200","::1","::1","TCP","4152","80  >  57954 [PSH, ACK] Seq=346016 Ack=4766 Win=2615040 Len=4088 [TCP PDU reassembled in 374]"
"371","35.346430000","::1","::1","TCP","64","57954  >  80 [ACK] Seq=4766 Ack=350104 Win=2605568 Len=0"
"372","35.346718600","::1","::1","TCP","4666","80  >  57954 [PSH, ACK] Seq=350104 Ack=4766 Win=2615040 Len=4602 [TCP PDU reassembled in 374]"
"373","35.346742000","::1","::1","TCP","64","57954  >  80 [ACK] Seq=4766 Ack=354706 Win=2600960 Len=0"
"374","35.348938400","::1","::1","HTTP","578","HTTP/1.1 200 OK  (text/html)"
"375","35.348971000","::1","::1","TCP","64","57954  >  80 [ACK] Seq=4766 Ack=355220 Win=2600448 Len=0"
"376","35.352821000","::1","::1","HTTP","866","HTTP/1.1 200 OK  (text/html)"
"377","35.352861800","::1","::1","TCP","64","57956  >  80 [ACK] Seq=1011 Ack=803 Win=2618112 Len=0"
"378","35.365429200","::1","::1","HTTP","1638","HTTP/1.1 200 OK  (text/html)"
"379","35.365460000","::1","::1","TCP","64","57955  >  80 [ACK] Seq=1106 Ack=1575 Win=2617344 Len=0"
"380","35.379083500","::1","::1","HTTP","961","GET /interface/patient_file/history/encounters.php HTTP/1.1 "
"381","35.379154500","::1","::1","TCP","64","80  >  57955 [ACK] Seq=1575 Ack=2003 Win=2617856 Len=0"
"382","35.380742500","::1","::1","HTTP","948","GET /controller.php?document&retrieve&patient_id=1&document_id=-1&as_file=false&original_file=true&disable_exit=false&show_original=true&context=patient_picture HTTP/1.1 "
"383","35.380792200","::1","::1","TCP","64","80  >  57956 [ACK] Seq=803 Ack=1895 Win=2618112 Len=0"
"384","35.426712100","::1","::1","HTTP","495","HTTP/1.1 200 OK  (text/html)"
"385","35.426757100","::1","::1","TCP","64","57959  >  80 [ACK] Seq=2032 Ack=946 Win=2617856 Len=0"
"386","35.480287400","::1","::1","HTTP","603","HTTP/1.1 200 OK  (text/html)"
"387","35.480315100","::1","::1","TCP","64","57956  >  80 [ACK] Seq=1895 Ack=1342 Win=2617600 Len=0"
"388","35.596359800","::1","::1","TCP","4152","80  >  57955 [PSH, ACK] Seq=1575 Ack=2003 Win=2617856 Len=4088 [TCP PDU reassembled in 392]"
"389","35.596399700","::1","::1","TCP","64","57955  >  80 [ACK] Seq=2003 Ack=5663 Win=2613248 Len=0"
"390","35.596446900","::1","::1","TCP","5576","80  >  57955 [PSH, ACK] Seq=5663 Ack=2003 Win=2617856 Len=5512 [TCP PDU reassembled in 392]"
"391","35.596461800","::1","::1","TCP","64","57955  >  80 [ACK] Seq=2003 Ack=11175 Win=2607616 Len=0"
"392","35.596775200","::1","::1","HTTP","69","HTTP/1.1 200 OK  (text/html)"
"393","35.596795500","::1","::1","TCP","64","57955  >  80 [ACK] Seq=2003 Ack=11180 Win=2607616 Len=0"
"394","36.661626900","::1","::1","HTTP","2623","HTTP/1.1 200 OK  (text/html)"
"395","36.661657000","::1","::1","TCP","64","57958  >  80 [ACK] Seq=2139 Ack=3150 Win=2615808 Len=0"
"396","39.610924600","::1","::1","HTTP","969","GET /interface/patient_file/summary/stats_full.php?active=all&category=medication HTTP/1.1 "
"397","39.610956500","::1","::1","TCP","64","80  >  57958 [ACK] Seq=3150 Ack=3044 Win=2616832 Len=0"
"398","39.733350400","::1","::1","TCP","4152","80  >  57958 [PSH, ACK] Seq=3150 Ack=3044 Win=2616832 Len=4088 [TCP PDU reassembled in 406]"
